{
  "$schema": "https://json-schema.org/draft/2020-12/schema",
  "$id": "https://pstack.dev/schemas/portability/profile.schema.json",
  "title": "HarnessProfile",
  "description": "Typed capability profile and layout bindings for an agent harness.",
  "type": "object",
  "required": ["host", "support_state", "bindings", "skills_dir", "plugin_manifest"],
  "properties": {
    "host": {
      "$ref": "host-id.schema.json#/$defs/host"
    },
    "support_state": {
      "type": "string",
      "enum": ["candidate", "mapped", "packaged", "verified", "supported"]
    },
    "skills_dir": {
      "type": "string",
      "description": "Relative project-local path where skills reside for this harness (e.g. .grok/skills, .agents/skills)."
    },
    "plugins_dir": {
      "type": "string",
      "description": "Host-level plugins directory where external or global plugins are installed."
    },
    "plugin_manifest": {
      "type": "string",
      "description": "Relative path to projected harness-native plugin manifest."
    },
    "bindings": {
      "type": "array",
      "items": {
        "$ref": "binding.schema.json"
      }
    },
    "evidence_ledger": {
      "type": "array",
      "items": {
        "$ref": "evidence.schema.json"
      }
    },
    "tool_mappings": {
      "$ref": "tool-mapping.schema.json"
    },
    "skill_order": {
      "type": "array",
      "items": {
        "$ref": "skill-order.schema.json"
      },
      "description": "Ordered 3-tier fallback table from pstack need to pstack, user, and builtin skills."
    },
    "runtime_conventions": {
      "$ref": "runtime-conventions.schema.json",
      "description": "Host-specific execution constraints, isolation modes, and model spawn fields."
    },
    "setup": {
      "$ref": "setup-projection.schema.json",
      "description": "Where this host declares its model and reasoning-effort setup surface, and which skill owns the host-specific steps. Absent means no declared setup surface (a GAP for /setup-pstack), never another host's fallback."
    }
  },
  "additionalProperties": false
}
