{
  "host": "opencode",
  "support_state": "packaged",
  "skills_dir": ".opencode/skills",
  "plugins_dir": "~/.opencode/plugins",
  "plugin_manifest": ".opencode-plugin/package.json",
  "setup": {
    "source": "none",
    "skill": null,
    "catalog": null,
    "overlay": null,
    "effort": "none"
  },
  "bindings": [
    {
      "host": "opencode",
      "capability": "agent.spawn",
      "implementation_status": "native",
      "primitive": "task",
      "enforcement": "hard",
      "verification_status": "static-only",
      "evidence_ref": ".audit/evidence/opencode-receipt.json"
    },
    {
      "host": "opencode",
      "capability": "agent.join",
      "implementation_status": "native",
      "primitive": "task (completion)",
      "enforcement": "hard",
      "verification_status": "static-only",
      "evidence_ref": ".audit/evidence/opencode-receipt.json"
    },
    {
      "host": "opencode",
      "capability": "agent.message",
      "implementation_status": "native",
      "primitive": "session message",
      "enforcement": "hard",
      "verification_status": "static-only",
      "evidence_ref": ".audit/evidence/opencode-receipt.json"
    },
    {
      "host": "opencode",
      "capability": "agent.cancel",
      "implementation_status": "native",
      "primitive": "task cancel",
      "enforcement": "hard",
      "verification_status": "static-only",
      "evidence_ref": ".audit/evidence/opencode-receipt.json"
    },
    {
      "host": "opencode",
      "capability": "agent.resume",
      "implementation_status": "native",
      "primitive": "opencode --continue",
      "enforcement": "hard",
      "verification_status": "static-only",
      "evidence_ref": ".audit/evidence/opencode-receipt.json"
    },
    {
      "host": "opencode",
      "capability": "workspace.shared",
      "implementation_status": "native",
      "primitive": "workspace folder (cwd)",
      "enforcement": "hard",
      "verification_status": "static-only",
      "evidence_ref": ".audit/evidence/opencode-receipt.json"
    },
    {
      "host": "opencode",
      "capability": "workspace.isolated",
      "implementation_status": "native",
      "primitive": "git worktree",
      "enforcement": "hard",
      "verification_status": "static-only",
      "evidence_ref": ".audit/evidence/opencode-receipt.json"
    },
    {
      "host": "opencode",
      "capability": "workspace.readonly",
      "implementation_status": "native",
      "primitive": "fs.readonly",
      "enforcement": "advisory",
      "verification_status": "static-only",
      "evidence_ref": ".audit/evidence/opencode-receipt.json"
    },
    {
      "host": "opencode",
      "capability": "human.ask",
      "implementation_status": "native",
      "primitive": "question",
      "enforcement": "advisory",
      "verification_status": "static-only",
      "evidence_ref": ".audit/evidence/opencode-receipt.json"
    },
    {
      "host": "opencode",
      "capability": "human.gate",
      "implementation_status": "native",
      "primitive": "question (blocking confirmation)",
      "enforcement": "hard",
      "verification_status": "static-only",
      "evidence_ref": ".audit/evidence/opencode-receipt.json"
    },
    {
      "host": "opencode",
      "capability": "plan.update",
      "implementation_status": "native",
      "primitive": "todo",
      "enforcement": "advisory",
      "verification_status": "static-only",
      "evidence_ref": ".audit/evidence/opencode-receipt.json"
    },
    {
      "host": "opencode",
      "capability": "schedule",
      "implementation_status": "gap",
      "primitive": null,
      "enforcement": "advisory",
      "verification_status": "static-only",
      "evidence_ref": ".audit/evidence/opencode-receipt.json",
      "notes": "No native cron scheduler in OpenCode"
    },
    {
      "host": "opencode",
      "capability": "monitor",
      "implementation_status": "shim",
      "primitive": "terminal (background) / ps",
      "enforcement": "soft",
      "verification_status": "static-only",
      "evidence_ref": ".audit/evidence/opencode-receipt.json"
    },
    {
      "host": "opencode",
      "capability": "session.persist",
      "implementation_status": "native",
      "primitive": "opencode session storage",
      "enforcement": "hard",
      "verification_status": "static-only",
      "evidence_ref": ".audit/evidence/opencode-receipt.json"
    },
    {
      "host": "opencode",
      "capability": "session.resume",
      "implementation_status": "native",
      "primitive": "opencode restore workspace",
      "enforcement": "hard",
      "verification_status": "static-only",
      "evidence_ref": ".audit/evidence/opencode-receipt.json"
    },
    {
      "host": "opencode",
      "capability": "evidence.capture",
      "implementation_status": "native",
      "primitive": "receipts under .audit/evidence/",
      "enforcement": "hard",
      "verification_status": "static-only",
      "evidence_ref": ".audit/evidence/opencode-receipt.json"
    },
    {
      "host": "opencode",
      "capability": "verify",
      "implementation_status": "native",
      "primitive": "scripts/verify_portable.py",
      "enforcement": "hard",
      "verification_status": "static-only",
      "evidence_ref": ".audit/evidence/opencode-receipt.json"
    }
  ],
  "evidence_ledger": [
    {
      "claim": "HISTORICAL runtime claim, superseded 2026-10-17: OpenCode implements required capabilities with a runtime proof bar. The durable receipt was then refreshed statically (canonical/adapter/package PASS, runtime UNTESTED), so this runtime claim is no longer current evidence; opencode claims packaged with static-only rows until `python3 scripts/verify_portable.py run --host opencode` records an observed_live settlement.",
      "kind": "runtime",
      "artifact": ".audit/evidence/opencode-receipt.json",
      "command": "python3 scripts/verify_portable.py run --host opencode",
      "timestamp": "2026-10-05T17:01:00Z"
    }
  ],
  "tool_mappings": {
    "file_read": "read",
    "file_edit": "edit",
    "file_write": "write",
    "shell_run": "terminal",
    "web_fetch": "webfetch",
    "web_search": "webfetch / search",
    "agent_spawn": "task",
    "agent_fanout": "N task in one turn",
    "agent_join": "task completion",
    "agent_message": "session message",
    "task_background": "terminal (background)",
    "tool_mcp": "mcp",
    "plan_update": "todo",
    "human_ask": "question"
  },
  "skill_order": [
    {
      "need": "TDD",
      "primary_pstack": "/tdd",
      "secondary_user": null,
      "fallback_builtin": null
    },
    {
      "need": "Review a diff or PR",
      "primary_pstack": "/interrogate",
      "secondary_user": null,
      "fallback_builtin": null
    },
    {
      "need": "Babysit",
      "primary_pstack": "playbooks/babysit.md",
      "secondary_user": null,
      "fallback_builtin": null
    },
    {
      "need": "Prove work is done",
      "primary_pstack": "/principle-prove-it-works",
      "secondary_user": null,
      "fallback_builtin": null
    },
    {
      "need": "Debug a failure",
      "primary_pstack": "playbooks/bug-fix.md",
      "secondary_user": null,
      "fallback_builtin": null
    },
    {
      "need": "Design a playbook",
      "primary_pstack": "/figure-it-out",
      "secondary_user": null,
      "fallback_builtin": null
    },
    {
      "need": "Spec then plan",
      "primary_pstack": null,
      "secondary_user": null,
      "fallback_builtin": "todo"
    },
    {
      "need": "Execute a written plan",
      "primary_pstack": "playbooks/feature.md",
      "secondary_user": null,
      "fallback_builtin": null
    }
  ],
  "runtime_conventions": {
    "max_subagent_depth": 1,
    "supported_isolation_modes": ["worktree", "shared"],
    "default_model": "opencode",
    "allowed_spawn_fields": [
      "prompt",
      "role",
      "isolation"
    ],
    "forbidden_spawn_fields": [
      "capability_mode",
      "environment"
    ],
    "wire_aliases": {
      "task": "spawn_subagent"
    }
  }
}
